{
  "schema_version": "outcome-operation-command.v1", "workflow_id": "outcome:CASE_001:1", "case_id": "CASE_001", "command_id": "OP_COMMAND_001", "operation_id": "OP_001", "operation_key_hash": "9999999999999999999999999999999999999999999999999999999999999999",
  "approval_receipt_ref": "urn:decision-receipt:001", "approval_receipt_hash": "5555555555555555555555555555555555555555555555555555555555555555", "approved_action_snapshot_ref": "urn:approved-action:001", "approved_action_snapshot_hash": "6666666666666666666666666666666666666666666666666666666666666666",
  "request_ref": "urn:operation-request:001", "request_hash": "aaaaaaaaaaaaaaaaaaaaaaaaaaaaaaaaaaaaaaaaaaaaaaaaaaaaaaaaaaaaaaaa", "external_idempotency_key_hash": "eeeeeeeeeeeeeeeeeeeeeeeeeeeeeeeeeeeeeeeeeeeeeeeeeeeeeeeeeeeeeeee",
  "effect_class": "NO_EXTERNAL_EFFECT", "required_for_closure": true, "compensable": false, "operation_sequence": 0, "epoch": 1, "source_revision": 11, "revision": 12, "fence": 3, "committed_event_sequence": 2, "attempt_no": 1,
  "deadline_at": "2026-07-24T08:05:00Z", "tool_capability_version": "synthetic-noop.v1", "runtime_mode": "JAVA_SIGNED_SYNTHETIC_NOOP_SHADOW", "synthetic_noop_marker": "JAVA_SIGNED_SYNTHETIC_NOOP_V1", "synthetic_only": true
}
